{
  "$schema": "https://json-schema.org/draft/2020-12/schema",
  "$id": "job-request.v1",
  "title": "Job Request (v1)",
  "description": "The architect↔worker seam, worker-facing half. A strict subset / projection of work-order.v1: exactly the job fields the Engineer needs to do the work, plus the schema_version stamp. One version family with WorkOrder v1 — a v1 Work Order projects to a v1 Job Request with no worker churn. The Engineer identity (Ruflo, Claude, stub) is irrelevant: any process that accepts this schema and returns a valid Invoice can serve as the Engineer.",
  "type": "object",
  "required": ["schema_version", "job_id", "issue", "repo", "title", "body", "route", "scope", "confidence"],
  "additionalProperties": false,
  "properties": {
    "schema_version": {
      "const": 1,
      "description": "Version of the Job Request contract. Additive changes bump the minor (consumers ignore unknown fields); breaking changes bump this major and open a compat window."
    },
    "job_id": {
      "type": "string",
      "description": "Unique identifier for this job (e.g. issue-101-20260613T120000Z)."
    },
    "issue": {
      "type": "integer",
      "description": "GitHub issue number."
    },
    "repo": {
      "type": "string",
      "pattern": "^[^/]+/[^/]+$",
      "description": "owner/repo the issue belongs to."
    },
    "title": {
      "type": "string",
      "description": "Issue title — the Engineer's one-line task description."
    },
    "body": {
      "type": "string",
      "description": "Issue body — full requirements and acceptance criteria."
    },
    "route": {
      "type": "string",
      "enum": ["gen-local", "gen-default", "gen-frontier"],
      "description": "Model tier the Architect selected for this job based on scope."
    },
    "scope": {
      "type": "string",
      "enum": ["xs", "s", "m", "l"],
      "description": "Architect's estimated complexity. Engineer reports scope_actual in the Invoice."
    },
    "confidence": {
      "type": "number",
      "minimum": 0,
      "maximum": 1,
      "description": "Classifier confidence that this issue is implementable autonomously."
    }
  }
}
